kew_id,Number,PrimeValue,EntryNumberQualifier,taxon_name,taxon_name_Stace,authors_Stace,Full name,pg_2C,pg_1C,Mbp_2C,Mbp_1C,PublishedPloidyLevel,AcceptedPloidyLevel,PloidyFootnoteID,PublishedChromosomeNumber,AcceptedChromosomeNumber,ChromosomeFootnoteID,Lifecycle,NewAPGFamily,Order,HigherGroup,EstimationMethod,Standard species,Reference,Highest level,Peridophyte Group,from GB material,DB
50881822-1,,,,Cedrus atlantica (Endl.) Carriere,Cedrus atlantica,(Endl.) Carriere,Cedrus atlantica,32.46625767,16.23312883,15876,7938,,,,,,,,Pinaceae,Pinales,,,,,Gymnosperm,,NA,C-ValueDB
676701-1,,,,Cedrus deodara (Roxb. ex D. Don) G. Don,Cedrus deodara,(Roxb. ex D. Don) G. Don,Cedrus deodara,32.66666667,16.33333333,15974,7987,,,,,,,,Pinaceae,Pinales,,,,,Gymnosperm,,NA,C-ValueDB
676705-1,,,,Cedrus libani A. Rich.,Cedrus libani,A. Rich.,Cedrus libani,32.06543967,16.03271984,15680,7840,,,,,,,,Pinaceae,Pinales,,,,,Gymnosperm,,NA,C-ValueDB
676705-1,,,,Cedrus libani A. Rich.,Cedrus libani,A. Rich.,Cedrus libani,32.56646217,16.28323108,15925,7962.5,,,,,,,,Pinaceae,Pinales,,,,,Gymnosperm,,NA,C-ValueDB
927512-1,848,TRUE,a,Celastrus orbiculatus Thunb.,Celastrus orbiculatus,Thunb.,Celastrus orbiculatus,0.77,0.385,377.3,188.65,2,2,z,,,n,P,Celastraceae,Celastrales,E,FC:PI,Pisum sat. 'Ctirad' & Glycine max 'Polanka'  848,"Fridley JD, Craddock A. 2015.  Contrasting growth phenology of native and invasive forest shrubs mediated by genome size. New Phytologist 207: 659-668.",Angiosperm,,n,C-ValueDB
316518-2,375,TRUE,a,Cenchrus echinatus L.,Cenchrus echinatus,L.,Cenchrus echinatus,5.2,2.6,2548,1274,,,p,-,,n,A,Poaceae,Poales,M,Fe,Hordeum vulgare cv. 'Sultan',"Bennett MD, Leitch IJ, Hanson L.  1998.  DNA amounts in two samples of angiosperm weeds.  Annals of Botany 82 (Supplement A): 121-134.",Angiosperm,,n,C-ValueDB
189935-1,783,TRUE,a,Centaurea aspera L.,Centaurea aspera,L.,Centaurea aspera,2.04,1.02,999.6,499.8,,,p,"20, 22, 44",,o,P,Asteraceae,Asterales,E,FC:PI,Petunia hybrida cv. 'PxPc6',"Garcia S, Hidalgo O, Jakovljevi? I, Siljak-Yakovlev S, Vigo J, Garnatje T, Vallès J. 2013. New data on genome size in 128 Asteraceae species and subspecies, with first assessments for 40 genera, 3 tribes and 2 subfamilies. Plant Biosystems 147: 1219-1227.",Angiosperm,,n,C-ValueDB
330052-2,783,TRUE,a,Centaurea calcitrapa L.,Centaurea calcitrapa,L.,Centaurea calcitrapa,1.85,0.925,906.5,453.25,,,p,20,20,o,P,Asteraceae,Asterales,E,FC:PI,Petunia hybrida cv. 'PxPc6',"Garcia S, Hidalgo O, Jakovljevi? I, Siljak-Yakovlev S, Vigo J, Garnatje T, Vallès J. 2013. New data on genome size in 128 Asteraceae species and subspecies, with first assessments for 40 genera, 3 tribes and 2 subfamilies. Plant Biosystems 147: 1219-1227.",Angiosperm,,n,C-ValueDB
190310-1,783,TRUE,a,Centaurea cyanus L.,Centaurea cyanus,L.,Centaurea cyanus,1.42,0.71,695.8,347.9,,,p,24,24,,A,Asteraceae,Asterales,E,FC:PI,Solanum lycopersicum cv. 'Montfavet',"Garcia S, Hidalgo O, Jakovljevi? I, Siljak-Yakovlev S, Vigo J, Garnatje T, Vallès J. 2013. New data on genome size in 128 Asteraceae species and subspecies, with first assessments for 40 genera, 3 tribes and 2 subfamilies. Plant Biosystems 147: 1219-1227.",Angiosperm,,n,C-ValueDB
190331-1,529,TRUE,a,Centaurea debeauxii Gren. & Godr.,Centaurea debeauxii,Gren. & Godr.,Centaurea debeauxii,4.3,2.15,2107,1053.5,4,4,,44,44,,P,Asteraceae,Asterales,E,CIA,Pisum sativum cv. 'Kleine Rheinländerin',"Bancheva S, Greilhuber J. 2006. Genome size in Bulgarian Centaurea s.l. (Asteraceae). Plant Systematics and Evolution 257: 95-117.",Angiosperm,,n,C-ValueDB
190753-1,529,TRUE,a,Centaurea jacea L.,Centaurea jacea,L.,Centaurea jacea,4,2,1960,980,4,4,,44,44,,P,Asteraceae,Asterales,E,CIA,Pisum sativum cv. 'Kleine Rheinländerin',"Bancheva S, Greilhuber J. 2006. Genome size in Bulgarian Centaurea s.l. (Asteraceae). Plant Systematics and Evolution 257: 95-117.",Angiosperm,,n,C-ValueDB
190753-1,783,TRUE,a2,Centaurea jacea L.,Centaurea jacea,L.,Centaurea jacea,4.1,2.05,2009,1004.5,,,p,22,22,,,Asteraceae,Asterales,E,FC:PI,Pisum sativum cv. 'Express Long',"Garcia S, Hidalgo O, Jakovljevi? I, Siljak-Yakovlev S, Vigo J, Garnatje T, Vallès J. 2013. New data on genome size in 128 Asteraceae species and subspecies, with first assessments for 40 genera, 3 tribes and 2 subfamilies. Plant Biosystems 147: 1219-1227.",Angiosperm,,n,C-ValueDB
191037-1,776,TRUE,a4,Centaurea montana L.,Centaurea montana,L.,Centaurea montana,3.96,1.98,1940.4,970.2,4,4,,44,44,,P,Asteraceae,Asterales,E,FC:PI,Solanum lycopersicum cv. 'Montfavet',"Pustahija F, Brown SC, Bogunic F, Bašic N, Muratovic E, Ollier S, Hidalgo O, Bourge M, Stevanovic V, Sijak-Yakovev S. 2013.  Small genomes dominate in plants growing on serpentine soils in West Balkans, an exhaustive study of 8 habitats covering 308 taxa.",Angiosperm,,n,C-ValueDB
191037-1,634,TRUE,a2,Centaurea montana L.,Centaurea montana,L.,Centaurea montana,2.76,1.38,1352.4,676.2,2,2,z,22,22,o,P,Asteraceae,Asterales,E,FC:PI,Pisum sativum cv. 'Express Long',"Siljak-Yakovlev S, Pustahija F, Šolic EM, Bogunic F, Muratovic E, Bašic N, Catrice O, Brown SC. 2010. Towards a genome size and chromosome number database of Balkan flora: C-values in 343 taxa with novel values for 242. Advanced Science Letters 3: 190-213",Angiosperm,,n,C-ValueDB
191100-1,783,TRUE,a,Centaurea nigra L.,Centaurea nigra,L.,Centaurea nigra,2.24,1.12,1097.6,548.8,,,p,24,24,,,Asteraceae,Asterales,E,FC:PI,Pisum sativum cv. 'Express Long',"Garcia S, Hidalgo O, Jakovljevi? I, Siljak-Yakovlev S, Vigo J, Garnatje T, Vallès J. 2013. New data on genome size in 128 Asteraceae species and subspecies, with first assessments for 40 genera, 3 tribes and 2 subfamilies. Plant Biosystems 147: 1219-1227.",Angiosperm,,n,C-ValueDB
191521-1,783,TRUE,a4,Centaurea scabiosa L.,Centaurea scabiosa,L.,Centaurea scabiosa,4.59,2.295,2249.1,1124.55,,,p,40,40,,,Asteraceae,Asterales,E,FC:PI,Pisum sativum cv. 'Express Long',"Garcia S, Hidalgo O, Jakovljevi? I, Siljak-Yakovlev S, Vigo J, Garnatje T, Vallès J. 2013. New data on genome size in 128 Asteraceae species and subspecies, with first assessments for 40 genera, 3 tribes and 2 subfamilies. Plant Biosystems 147: 1219-1227.",Angiosperm,,n,C-ValueDB
191626-1,529,TRUE,a,Centaurea solstitialis L.,Centaurea solstitialis,L.,Centaurea solstitialis,1.74,0.87,852.6,426.3,2,2,,16,16,,A,Asteraceae,Asterales,E,CIA,Pisum sativum cv. 'Kleine Rheinländerin',"Bancheva S, Greilhuber J. 2006. Genome size in Bulgarian Centaurea s.l. (Asteraceae). Plant Systematics and Evolution 257: 95-117.",Angiosperm,,n,C-ValueDB
326619-2,776,TRUE,a,Centaurium erythraea Rafn.,Centaurium erythraea,Rafn.,Centaurium erythraea,2.12,1.06,1038.8,519.4,,,p,"20,40,42",,o,B,Gentianaceae,Gentianales,E,FC:PI,Petunia hybrida cv. 'PxPc6',"Pustahija F, Brown SC, Bogunic F, Bašic N, Muratovic E, Ollier S, Hidalgo O, Bourge M, Stevanovic V, Sijak-Yakovev S. 2013.  Small genomes dominate in plants growing on serpentine soils in West Balkans, an exhaustive study of 8 habitats covering 308 taxa.",Angiosperm,,n,C-ValueDB
326619-2,154,TRUE,a,Centaurium erythraea Rafn.,Centaurium erythraea,Rafn.,Centaurium erythraea,2.4,1.2,1176,588,,,p,-,,n,A,Gentianaceae,Gentianales,E,Fe,Senecio vulgaris (PBI population),Band SR. (pers. comm. 1984).,Angiosperm,,y,C-ValueDB
859258-1,638,TRUE,a,Centranthus calcitrapae (L.) Dufr.,Centranthus calcitrapae,(L.) Dufr.,Centranthus calcitrapae,1.56,0.78,764.4,382.2,4,4,z,32,32,o,A,Caprifoliaceae,Dipsacales,E,FC:PI,Petunia hybrida cv. 'PxPc6',"Hidalgo O, Mathez J, Garcia S, Garnatje T, Pellicer J, Vallès J. 2010. Genome size study in the Valerianaceae: first results and new hypotheses. Journal of Botany 2010:  797246",Angiosperm,,n,C-ValueDB
859275-1,638,TRUE,a,Centranthus ruber (L.) DC.,Centranthus ruber,(L.) DC.,Centranthus ruber,1.16,0.58,568.4,284.2,4,4,,32,32,,P,Caprifoliaceae,Dipsacales,E,FC:PI,Petunia hybrida cv. 'PxPc6',"Hidalgo O, Mathez J, Garcia S, Garnatje T, Pellicer J, Vallès J. 2010. Genome size study in the Valerianaceae: first results and new hypotheses. Journal of Botany 2010:  797246",Angiosperm,,n,C-ValueDB
622369-1,176,TRUE,a,Cephalanthera damasonium (Mill.) Druce,Cephalanthera damasonium,(Mill.) Druce,Cephalanthera damasonium,32.8,16.4,16072,8036,2,2,,36,36,,P,Orchidaceae,Asparagales,M,Fe,Allium cepa assumed cv. 'Ailsa Craig',"Kiehn M, Schweizer D. (pers. comm. 1986).",Angiosperm,,n,C-ValueDB
622389-1,176,TRUE,a,Cephalanthera longifolia (L.) Fritsch,Cephalanthera longifolia,(L.) Fritsch,Cephalanthera longifolia,33.6,16.8,16464,8232,2,2,,32,32,,P,Orchidaceae,Asparagales,M,Fe,Allium cepa assumed cv. 'Ailsa Craig',"Kiehn M, Schweizer D. (pers. comm. 1986).",Angiosperm,,n,C-ValueDB
622405-1,776,TRUE,a,Cephalanthera rubra (L.) Rich.,Cephalanthera rubra,(L.) Rich.,Cephalanthera rubra,31.28,15.64,15327.2,7663.6,,,p,"36,44,48",,o,P,Orchidaceae,Asparagales,M,FC:PI,Artemisia arborescens 'Crete',"Pustahija F, Brown SC, Bogunic F, Bašic N, Muratovic E, Ollier S, Hidalgo O, Bourge M, Stevanovic V, Sijak-Yakovev S. 2013.  Small genomes dominate in plants growing on serpentine soils in West Balkans, an exhaustive study of 8 habitats covering 308 taxa.",Angiosperm,,n,C-ValueDB
319110-1,652,TRUE,a,Cephalaria gigantea (Ledeb.) Bobrov,Cephalaria gigantea,(Ledeb.) Bobrov,Cephalaria gigantea,13.726,6.863,6725.74,3362.87,4,4,,36,36,,P,Caprifoliaceae,Dipsacales,E,FC:PI,Pisum sativum cv. 'Kleine Rheinländerin',"Temsch EM, Greilhuber J. 2010. Genome size in Dipsacaceae and Morina longifolia (Morinaceae). Plant Systematics and Evolution 289: 45-56.",Angiosperm,,n,C-ValueDB
302288-2,427,TRUE,a,Cerastium alpinum L.,Cerastium alpinum,L.,Cerastium alpinum,3.7,1.85,1813,906.5,4,4,,72,72,,P,Caryophyllaceae,Caryophyllales,E,FC:DAPI,Cerastium eriophorum,"Boscaiu M, Vicente O, Ehrendorfer F. 1999. Chromosome numbers, karyotypes and nuclear DNA contents from perennial polyploid groups of Cerastium (Caryophyllaceae). Plant Systematics and Evolution 218: 13-21.",Angiosperm,,n,C-ValueDB
52333-2,781,TRUE,a,Cerastium cerastoides (L.) Britton,Cerastium cerastoides,(L.) Britton,Cerastium cerastoides,1.4,0.7,686,343,2,2,z,36,36,o,P,Caryophyllaceae,Caryophyllales,E,FC:PI,Solanum lycopersicum 'Stupicke polni rane',"Loureiro J, Castro M, Cerca de Oliveira J, Mota L, Torices R. 2013 Genome size variation and polyploidy incidence in the alpine flora from Spain. Annales del Jardin Botánico de Madrid 70: 39-47.",Angiosperm,,n,C-ValueDB
152255-1,105,TRUE,a,Cerastium fontanum Baumg.,Cerastium fontanum,Baumg.,Cerastium fontanum,5.8,2.9,2842,1421,16,16,,144,144,,P,Caryophyllaceae,Caryophyllales,E,Fe,Hordeum vulgare cv. 'Sultan',"Bennett MD,  Smith JB, Lewis Smith RI. 1982. DNA amounts of angiosperms from the Antarctic and South Georgia. Environmental and Experimental Botany 22: 307-318.",Angiosperm,,n,C-ValueDB
30006047-2,381,TRUE,a,Ceratophyllum demersum L.,Ceratophyllum demersum,L.,Ceratophyllum demersum,1.375,0.6875,673.75,336.875,6,6,,c. 70,,,P,Ceratophyllaceae,Ceratophyllales,BA,Fe,Vigna radiata cv. 'Berken',"Leitch IJ, Hanson L. 2002. DNA C-values in seven families fill phylogenetic gaps in the basal angiosperms.  Botanical Journal of the Linnean Society 140: 175-179",Angiosperm,,n,C-ValueDB
722128-1,262,TRUE,a,Chaenomeles speciosa (Sweet) Nakai,Chaenomeles speciosa,(Sweet) Nakai,Chaenomeles speciosa,1.2,0.6,588,294,2,2,z,34,34,o,P,Rosaceae,Rosales,E,FC:PI,Gallus,"Dickson EE, Arumuganathan K, Kresovich S, Doyle JJ. 1992. Nuclear DNA content variation within the Rosaceae. American Journal of Botany 79: 1081-1086.",Angiosperm,,n,C-ValueDB
801402-1,730,TRUE,a,Chaenorhinum origanifolium (L.) Kostel.,Chaenorhinum origanifolium,(L.) Kostel.,Chaenorhinum origanifolium,1.13,0.565,553.7,276.85,2,,,14,14,o,P,Plantaginaceae,Lamiales,E,FC:PI,Solanum lycopersicum 'Stupicke polni rane',"Castro M, Castro S, Loureiro J. 2012. Genome size variation and incidence of polyploidy in Scrophulariaceae sensu lato from the Iberian Peninsula. AoB Plants 2012: psl037.",Angiosperm,,n,C-ValueDB
192489-1,32,TRUE,a,Chamaemelum nobile (L.) All.,Chamaemelum nobile,(L.) All.,Chamaemelum nobile,10.6,5.3,5194,2597,2,2,,18,18,,P,Asteraceae,Asterales,E,Fe,Allium cepa cv. 'Ailsa Craig',"Nagl W, Ehrendorfer F. 1974. DNA content, heterochromatin, mitotic index, and growth in perennial and annual Anthemidea (Asteraceae). Plant Systematics and Evolution 123: 35-54.",Angiosperm,,n,C-ValueDB
611374-1,158,TRUE,a,Chamaenerion angustifolium (L.) Scop.,Chamaenerion angustifolium,(L.) Scop.,Chamaenerion angustifolium,0.8,0.4,392,196,2,2,,36,36,,P,Onagraceae,Myrtales,E,Fe,Senecio vulgaris (PBI population),"Mowforth MA.1986.  Variation in nuclear DNA amounts in flowering plants:  an ecological analysis. PhD. Thesis, University of Sheffield.  Specific reference for Poa annua in Mowforth MA and Grime JP.  1989.  Intra-Population Variation in Nuclear DNA Amount",Angiosperm,,y,C-ValueDB
303589-2,776,TRUE,a,Chelidonium majus L.,Chelidonium majus,L.,Chelidonium majus,2.26,1.13,1107.4,553.7,2,2,,12,12,,P,Papaveraceae,Ranunculales,E,FC:PI,Petunia hybrida cv. 'PxPc6',"Pustahija F, Brown SC, Bogunic F, Bašic N, Muratovic E, Ollier S, Hidalgo O, Bourge M, Stevanovic V, Sijak-Yakovev S. 2013.  Small genomes dominate in plants growing on serpentine soils in West Balkans, an exhaustive study of 8 habitats covering 308 taxa.",Angiosperm,,n,C-ValueDB
55993-2,375,TRUE,a6,Chenopodium album L.,Chenopodium album,L.,Chenopodium album,4.6,2.3,2254,1127,6,6,,54,54,,A,Amaranthaceae,Caryophyllales,E,Fe,Hordeum vulgare cv. 'Sultan',"Bennett MD, Leitch IJ, Hanson L.  1998.  DNA amounts in two samples of angiosperm weeds.  Annals of Botany 82 (Supplement A): 121-134.",Angiosperm,,n,C-ValueDB
55993-2,455,TRUE,a2,Chenopodium album L.,Chenopodium album,L.,Chenopodium album,1.53,0.765,749.7,374.85,2,2,z,18,18,o,A,Amaranthaceae,Caryophyllales,E,Fe,Allium cepa cv. 'Nasik Red',Ohri D. (pers. comm. 2002),Angiosperm,,n,C-ValueDB
55993-2,455,TRUE,a4,Chenopodium album L.,Chenopodium album,L.,Chenopodium album,3.26,1.63,1597.4,798.7,4,4,z,36,36,o,A,Amaranthaceae,Caryophyllales,E,Fe,Allium cepa cv. 'Nasik Red',Ohri D. (pers. comm. 2002),Angiosperm,,n,C-ValueDB
56074-2,455,TRUE,a,Chenopodium bushianum Aellen,Chenopodium bushianum,Aellen,Chenopodium bushianum,3.18,1.59,1558.2,779.1,4,4,z,36,36,o,A,Amaranthaceae,Caryophyllales,E,Fe,Allium cepa cv. 'Nasik Red',Ohri D. (pers. comm. 2002),Angiosperm,,n,C-ValueDB
164928-1,455,TRUE,a,Chenopodium ficifolium Sm.,Chenopodium ficifolium,Sm.,Chenopodium ficifolium,1.325,0.6625,649.25,324.625,2,2,z,18,18,o,A,Amaranthaceae,Caryophyllales,E,Fe,Allium cepa cv. 'Nasik Red',Ohri D. (pers. comm. 2002),Angiosperm,,n,C-ValueDB
164949-1,455,TRUE,a,Chenopodium giganteum D. Don,Chenopodium giganteum,D. Don,Chenopodium giganteum,4.39,2.195,2151.1,1075.55,6,6,z,54,54,o,A,Amaranthaceae,Caryophyllales,E,Fe,Allium cepa cv. 'Nasik Red',Ohri D. (pers. comm. 2002),Angiosperm,,n,C-ValueDB
60447126-2,455,TRUE,a,Chenopodium opulifolium Schrad. ex W.D.J. Koch & Ziz,Chenopodium opulifolium,Schrad. ex W.D.J. Koch & Ziz,Chenopodium opulifolium,2.66,1.33,1303.4,651.7,4,4,z,36,36,o,A,Amaranthaceae,Caryophyllales,E,Fe,Allium cepa cv. 'Nasik Red',Ohri D. (pers. comm. 2002),Angiosperm,,n,C-ValueDB
309537-2,721,TRUE,a,Chenopodium pratericola Rydb.,Chenopodium pratericola,Rydb.,Chenopodium pratericola,2.12,1.06,1038.8,519.4,,,p,,,n,A,Amaranthaceae,Caryophyllales,E,FC:PI,Pisum sativum cv. 'Dwarf Gray Sugar',"Bai C, Alverson WS, Follansbee A, Waller DM. 2012.  New reports of nuclear DNA content for 407 U.S. plant species. Annals of Botany: 110:1623-1629",Angiosperm,,n,C-ValueDB
30126588-2,630,TRUE,a,Chenopodium strictum Roth,Chenopodium strictum,Roth,Chenopodium strictum,1.6,0.8,784,392,4,4,,,,n,A,Amaranthaceae,Caryophyllales,E,FC:PI,Pisum sativum cv. 'Ctirad',"Kubešová M, Moravcová L, Suda J, Jarošik V, Pyšek P. 2010. Naturalized plants have smaller genomes than their non-invading relatives: a flow cytometric analysis of the Czech alien flora. Preslia 82: 81-96.",Angiosperm,,n,C-ValueDB
165311-1,455,TRUE,a,Chenopodium vulvaria L.,Chenopodium vulvaria,L.,Chenopodium vulvaria,1.27,0.635,622.3,311.15,2,2,z,18,18,o,A,Amaranthaceae,Caryophyllales,E,Fe,Allium cepa cv. 'Nasik Red',Ohri D. (pers. comm. 2002),Angiosperm,,n,C-ValueDB
486336-1,2,TRUE,a!,Cicer arietinum L.,Cicer arietinum,L.,Cicer arietinum,2,1,980,490,2,2,z,16,16,o,A,Fabaceae,Fabales,E,Fe,Allium cepa cv. 'Ailsa Craig',"Bennett MD, Smith JB. 1976. Nuclear DNA amounts in angiosperms. Philosophical Transactions of the Royal Society of London Series B-Biological Sciences 274: 227-274.",Angiosperm,,n,C-ValueDB
194423-1,783,TRUE,a,Cicerbita alpina (L.) Wallr.,Cicerbita alpina,(L.) Wallr.,Cicerbita alpina,5.81,2.905,2846.9,1423.45,,,p,18,18,o,P,Asteraceae,Asterales,E,FC:PI,Petunia hybrida cv. 'PxPc6',"Garcia S, Hidalgo O, Jakovljevi? I, Siljak-Yakovlev S, Vigo J, Garnatje T, Vallès J. 2013. New data on genome size in 128 Asteraceae species and subspecies, with first assessments for 40 genera, 3 tribes and 2 subfamilies. Plant Biosystems 147: 1219-1227.",Angiosperm,,n,C-ValueDB
194479-1,783,TRUE,a,Cicerbita plumieri (L.) Kirschl.,Cicerbita plumieri,(L.) Kirschl.,Cicerbita plumieri,5.75,2.875,2817.5,1408.75,,,p,16,16,o,P,Asteraceae,Asterales,E,FC:PI,Petunia hybrida cv. 'PxPc6',"Garcia S, Hidalgo O, Jakovljevi? I, Siljak-Yakovlev S, Vigo J, Garnatje T, Vallès J. 2013. New data on genome size in 128 Asteraceae species and subspecies, with first assessments for 40 genera, 3 tribes and 2 subfamilies. Plant Biosystems 147: 1219-1227.",Angiosperm,,n,C-ValueDB
194533-1,776,TRUE,a,Cichorium intybus L.,Cichorium intybus,L.,Cichorium intybus,2.65,1.325,1298.5,649.25,,,p,,,n,P,Asteraceae,Asterales,E,FC:PI,Petunia hybrida cv. 'PxPc6',"Pustahija F, Brown SC, Bogunic F, Bašic N, Muratovic E, Ollier S, Hidalgo O, Bourge M, Stevanovic V, Sijak-Yakovev S. 2013.  Small genomes dominate in plants growing on serpentine soils in West Balkans, an exhaustive study of 8 habitats covering 308 taxa.",Angiosperm,,n,C-ValueDB
611469-1,776,TRUE,a,Circaea lutetiana L.,Circaea lutetiana,L.,Circaea lutetiana,1.16,0.58,568.4,284.2,2,2,,22,22,,P,Onagraceae,Myrtales,E,FC:PI,Solanum lycopersicum cv. 'Montfavet',"Pustahija F, Brown SC, Bogunic F, Bašic N, Muratovic E, Ollier S, Hidalgo O, Bourge M, Stevanovic V, Sijak-Yakovev S. 2013.  Small genomes dominate in plants growing on serpentine soils in West Balkans, an exhaustive study of 8 habitats covering 308 taxa.",Angiosperm,,n,C-ValueDB
30076919-2,472,TRUE,a,Cirsium acaule Scop.,Cirsium acaule,Scop.,Cirsium acaule,2.62,1.31,1283.8,641.9,2,2,z,34,34,o,P,Asteraceae,Asterales,E,FC:PI,Solanum lycopersicum 'Stupicke polni rane',"Bureš P, Wang Y-F, Horova L, Suda J. 2004. Genome size variation in Central European species of Cirsium (Compositae) and their natural hybrids. Annals of Botany 94: 353-363.",Angiosperm,,n,C-ValueDB
195034-1,472,TRUE,anew,Cirsium arvense (L.) Scop.,Cirsium arvense,(L.) Scop.,Cirsium arvense,2.84,1.42,1391.6,695.8,2,2,z,34,34,o,P,Asteraceae,Asterales,E,FC:PI,Solanum lycopersicum 'Stupicke polni rane',"Bureš P, Wang Y-F, Horova L, Suda J. 2004. Genome size variation in Central European species of Cirsium (Compositae) and their natural hybrids. Annals of Botany 94: 353-363.",Angiosperm,,n,C-ValueDB
195318-1,472,TRUE,a,Cirsium eriophorum (L.) Scop.,Cirsium eriophorum,(L.) Scop.,Cirsium eriophorum,3.6,1.8,1764,882,2,2,z,34,34,o,B,Asteraceae,Asterales,E,FC:PI,Solanum lycopersicum 'Stupicke polni rane',"Bureš P, Wang Y-F, Horova L, Suda J. 2004. Genome size variation in Central European species of Cirsium (Compositae) and their natural hybrids. Annals of Botany 94: 353-363.",Angiosperm,,n,C-ValueDB
195465-1,472,TRUE,a,Cirsium heterophyllum (L.) Hill,Cirsium heterophyllum,(L.) Hill,Cirsium heterophyllum,2.14,1.07,1048.6,524.3,2,2,z,34,34,o,P,Asteraceae,Asterales,E,FC:PI,Solanum lycopersicum 'Stupicke polni rane',"Bureš P, Wang Y-F, Horova L, Suda J. 2004. Genome size variation in Central European species of Cirsium (Compositae) and their natural hybrids. Annals of Botany 94: 353-363.",Angiosperm,,n,C-ValueDB
195767-1,472,TRUE,a,Cirsium oleraceum (L.) Scop.,Cirsium oleraceum,(L.) Scop.,Cirsium oleraceum,2.32,1.16,1136.8,568.4,2,2,z,34,34,o,P,Asteraceae,Asterales,E,FC:PI,Solanum lycopersicum 'Stupicke polni rane',"Bureš P, Wang Y-F, Horova L, Suda J. 2004. Genome size variation in Central European species of Cirsium (Compositae) and their natural hybrids. Annals of Botany 94: 353-363.",Angiosperm,,n,C-ValueDB
195790-1,472,TRUE,anew,Cirsium palustre (L.) Scop.,Cirsium palustre,(L.) Scop.,Cirsium palustre,2.58,1.29,1264.2,632.1,2,2,z,34,34,o,B,Asteraceae,Asterales,E,FC:PI,Solanum lycopersicum 'Stupicke polni rane',"Bureš P, Wang Y-F, Horova L, Suda J. 2004. Genome size variation in Central European species of Cirsium (Compositae) and their natural hybrids. Annals of Botany 94: 353-363.",Angiosperm,,n,C-ValueDB
196145-1,783,TRUE,a,Cirsium tuberosum (L.) All.,Cirsium tuberosum,(L.) All.,Cirsium tuberosum,11.26,5.63,5517.4,2758.7,,,p,34,34,o,P,Asteraceae,Asterales,E,FC:PI,Pisum sativum cv. 'Express Long',"Garcia S, Hidalgo O, Jakovljevi? I, Siljak-Yakovlev S, Vigo J, Garnatje T, Vallès J. 2013. New data on genome size in 128 Asteraceae species and subspecies, with first assessments for 40 genera, 3 tribes and 2 subfamilies. Plant Biosystems 147: 1219-1227.",Angiosperm,,n,C-ValueDB
196191-1,472,TRUE,anew,Cirsium vulgare (Savi) Ten.,Cirsium vulgare,(Savi) Ten.,Cirsium vulgare,5.54,2.77,2714.6,1357.3,4,4,z,68,68,o,B,Asteraceae,Asterales,E,FC:PI,Solanum lycopersicum 'Stupicke polni rane',"Bureš P, Wang Y-F, Horova L, Suda J. 2004. Genome size variation in Central European species of Cirsium (Compositae) and their natural hybrids. Annals of Botany 94: 353-363.",Angiosperm,,n,C-ValueDB
59701-2,77,TRUE,a,Clarkia amoena (Lehm.) A. Nelson & J.F. Macbr.,Clarkia amoena,(Lehm.) A. Nelson & J.F. Macbr.,Clarkia amoena,4.2,2.1,2058,1029,2,2,z,14,14,o,A,Onagraceae,Myrtales,E,Fe,Allium cepa cv. 'Ailsa Craig',Narayan RKI. (pers. comm. 1978),Angiosperm,,n,C-ValueDB
709592-1,814,TRUE,a,Clematis cirrhosa L.,Clematis cirrhosa,L.,Clematis cirrhosa,19.08,9.54,9349.2,4674.6,,,p,,,n,P,Ranunculaceae,Ranunculales,E,FC:PI,Artemisia arborescens 'Crete',"Bou Dagher-Kharrat M, Abdel-Samad N, Douaihy B, Bourge M, Fridlender A, Siljak-Yakovlev S, Brown SC. 2013.  Nuclear DNA C-values for biodiversity screening: Case of the Lebanese flora. Plant Biosystems 147: 1228-1237.",Angiosperm,,n,C-ValueDB
709687-1,466,TRUE,a,Clematis flammula L.,Clematis flammula,L.,Clematis flammula,30.3,15.15,14847,7423.5,,,p,-,,n,P,Ranunculaceae,Ranunculales,E,FC:PI,Agave americana,"Zonneveld BJM, Leitch IJ, Bennett MD. 2005. First nuclear DNA amounts in more than 300 angiosperms. Annals of Botany 96: 229-244",Angiosperm,,n,C-ValueDB
709900-1,466,TRUE,a,Clematis montana Buch.-Ham. ex DC.,Clematis montana,Buch.-Ham. ex DC.,Clematis montana,20.3,10.15,9947,4973.5,,,p,-,,n,P,Ranunculaceae,Ranunculales,E,FC:PI,Agave americana,"Zonneveld BJM, Leitch IJ, Bennett MD. 2005. First nuclear DNA amounts in more than 300 angiosperms. Annals of Botany 96: 229-244",Angiosperm,,n,C-ValueDB
319145-2,776,TRUE,a,Clematis vitalba L.,Clematis vitalba,L.,Clematis vitalba,16.81,8.405,8236.9,4118.45,2,2,,16,16,,P,Ranunculaceae,Ranunculales,E,FC:PI,Pisum sativum cv. 'Express Long',"Pustahija F, Brown SC, Bogunic F, Bašic N, Muratovic E, Ollier S, Hidalgo O, Bourge M, Stevanovic V, Sijak-Yakovev S. 2013.  Small genomes dominate in plants growing on serpentine soils in West Balkans, an exhaustive study of 8 habitats covering 308 taxa.",Angiosperm,,n,C-ValueDB
61206-2,776,TRUE,a,Clinopodium vulgare L.,Clinopodium vulgare,L.,Clinopodium vulgare,0.89,0.445,436.1,218.05,,,p,"20,21,26,27",,o,P,Lamiaceae,Lamiales,E,FC:PI,Solanum lycopersicum cv. 'Montfavet',"Pustahija F, Brown SC, Bogunic F, Bašic N, Muratovic E, Ollier S, Hidalgo O, Bourge M, Stevanovic V, Sijak-Yakovev S. 2013.  Small genomes dominate in plants growing on serpentine soils in West Balkans, an exhaustive study of 8 habitats covering 308 taxa.",Angiosperm,,n,C-ValueDB
281414-1,599,TRUE,a,Cochlearia danica L.,Cochlearia danica,L.,Cochlearia danica,1.4,0.7,686,343,,,p,"(33), 42",,o,,Brassicaceae,Brassicales,E,FC:PI,Raphanus sativus cv. 'Voran',"Lysák MA, Koch MA, Beaulieu JM, Meister A, Leitch IJ. 2009. The dynamic ups and downs of genome size evolution in Brassicaceae. Molecular Biology and Evolution 26: 85-98.",Angiosperm,,n,C-ValueDB
281469-1,599,TRUE,a,Cochlearia officinalis L.,Cochlearia officinalis,L.,Cochlearia officinalis,1.5,0.75,735,367.5,4,4,,32,32,,,Brassicaceae,Brassicales,E,FC:PI,Raphanus sativus cv. 'Voran',"Lysák MA, Koch MA, Beaulieu JM, Meister A, Leitch IJ. 2009. The dynamic ups and downs of genome size evolution in Brassicaceae. Molecular Biology and Evolution 26: 85-98.",Angiosperm,,n,C-ValueDB
281484-1,350,TRUE,a,Cochlearia pyrenaica DC.,Cochlearia pyrenaica,DC.,Cochlearia pyrenaica,0.8,0.4,392,196,2,2,,12,12,,B-P,Brassicaceae,Brassicales,E,Fe,Allium cepa cv. 'Fruhstamn' + Pisum sativum cv. 'Kleine Rheinlanderin',"Krisai R, Greilhuber J.  1997.   Cochlearia pyrenaica DC., das Löffelkraut, in Oberöstererreich (mit Anmerkungen zur Karyologie und zur Genomgrösse. Beiträge zur Naturkunde Oberösterreichs 5: 151-160.",Angiosperm,,n,C-ValueDB
533232-1,468,TRUE,a!,Colchicum autumnale L.,Colchicum autumnale,L.,Colchicum autumnale,5.89,2.945,2886.1,1443.05,4,4,,36,36,,P,Colchicaceae,Liliales,M,FC:EB,Petunia hybrida cv. 'PxPc6',"Fridlender A, Brown S, Verlaque R, Crosnier MT, Pech N. 2002. Cytometric determination of genome size in Colchicum species (Liliales, Colchicaceae) of the western Mediterranean area. Plant Cell Reports 21: 347-352.",Angiosperm,,n,C-ValueDB
